{"$schema":"http://json-schema.org/draft-07/schema#","title":"TeamRating","type":"object","properties":{"team_code":{"type":"string"},"team_name":{"type":"string"},"group":{"type":"string"},"overall":{"type":"number"},"attack":{"type":"number"},"defense":{"type":"number"},"experience":{"type":"integer"},"home_strength":{"type":"number"},"is_placeholder":{"type":"boolean"},"confidence_penalty":{"type":"number"}}}