[
  {
    "team_code": "ARG",
    "team_name": "Argentina",
    "group": "GROUP_B",
    "overall": 2150,
    "attack": 2100,
    "defense": 1950,
    "experience": 95,
    "home_strength": 1.1,
    "is_placeholder": false,
    "confidence_penalty": 0.0
  },
  {
    "team_code": "BRA",
    "team_name": "Brazil",
    "group": "GROUP_B",
    "overall": 2120,
    "attack": 2150,
    "defense": 1900,
    "experience": 92,
    "home_strength": 1.05,
    "is_placeholder": false,
    "confidence_penalty": 0.0
  },
  {
    "team_code": "FRA",
    "team_name": "France",
    "group": "GROUP_C",
    "overall": 2100,
    "attack": 2050,
    "defense": 2000,
    "experience": 90,
    "home_strength": 1.05,
    "is_placeholder": false,
    "confidence_penalty": 0.0
  },
  {
    "team_code": "ENG",
    "team_name": "England",
    "group": "GROUP_C",
    "overall": 2050,
    "attack": 2000,
    "defense": 1980,
    "experience": 88,
    "home_strength": 1.08,
    "is_placeholder": false,
    "confidence_penalty": 0.0
  },
  {
    "team_code": "GER",
    "team_name": "Germany",
    "group": "GROUP_C",
    "overall": 2030,
    "attack": 1980,
    "defense": 2000,
    "experience": 90,
    "home_strength": 1.1,
    "is_placeholder": false,
    "confidence_penalty": 0.0
  },
  {
    "team_code": "ESP",
    "team_name": "Spain",
    "group": "GROUP_C",
    "overall": 2080,
    "attack": 2100,
    "defense": 1950,
    "experience": 89,
    "home_strength": 1.05,
    "is_placeholder": false,
    "confidence_penalty": 0.0
  },
  {
    "team_code": "POR",
    "team_name": "Portugal",
    "group": "GROUP_D",
    "overall": 2000,
    "attack": 2050,
    "defense": 1880,
    "experience": 85,
    "home_strength": 1.05,
    "is_placeholder": false,
    "confidence_penalty": 0.0
  },
  {
    "team_code": "NED",
    "team_name": "Netherlands",
    "group": "GROUP_D",
    "overall": 1980,
    "attack": 1950,
    "defense": 1920,
    "experience": 85,
    "home_strength": 1.05,
    "is_placeholder": false,
    "confidence_penalty": 0.0
  },
  {
    "team_code": "ITA",
    "team_name": "Italy",
    "group": "GROUP_D",
    "overall": 2010,
    "attack": 1900,
    "defense": 2050,
    "experience": 90,
    "home_strength": 1.08,
    "is_placeholder": false,
    "confidence_penalty": 0.0
  },
  {
    "team_code": "CRO",
    "team_name": "Croatia",
    "group": "GROUP_D",
    "overall": 1950,
    "attack": 1880,
    "defense": 1980,
    "experience": 87,
    "home_strength": 1.05,
    "is_placeholder": false,
    "confidence_penalty": 0.0
  },
  {
    "team_code": "BEL",
    "team_name": "Belgium",
    "group": "GROUP_G",
    "overall": 1990,
    "attack": 2000,
    "defense": 1900,
    "experience": 84,
    "home_strength": 1.05,
    "is_placeholder": false,
    "confidence_penalty": 0.0
  },
  {
    "team_code": "URU",
    "team_name": "Uruguay",
    "group": "GROUP_B",
    "overall": 1900,
    "attack": 1950,
    "defense": 1920,
    "experience": 82,
    "home_strength": 1.02,
    "is_placeholder": false,
    "confidence_penalty": 0.0
  },
  {
    "team_code": "COL",
    "team_name": "Colombia",
    "group": "GROUP_B",
    "overall": 1850,
    "attack": 1900,
    "defense": 1820,
    "experience": 78,
    "home_strength": 1.1,
    "is_placeholder": false,
    "confidence_penalty": 0.0
  },
  {
    "team_code": "MEX",
    "team_name": "Mexico",
    "group": "GROUP_A",
    "overall": 1820,
    "attack": 1850,
    "defense": 1780,
    "experience": 82,
    "home_strength": 1.2,
    "is_placeholder": false,
    "confidence_penalty": 0.0
  },
  {
    "team_code": "USA",
    "team_name": "USA",
    "group": "GROUP_A",
    "overall": 1800,
    "attack": 1820,
    "defense": 1750,
    "experience": 76,
    "home_strength": 1.2,
    "is_placeholder": false,
    "confidence_penalty": 0.0
  },
  {
    "team_code": "CAN",
    "team_name": "Canada",
    "group": "GROUP_A",
    "overall": 1720,
    "attack": 1750,
    "defense": 1680,
    "experience": 68,
    "home_strength": 1.25,
    "is_placeholder": false,
    "confidence_penalty": 0.0
  },
  {
    "team_code": "JPN",
    "team_name": "Japan",
    "group": "GROUP_E",
    "overall": 1780,
    "attack": 1800,
    "defense": 1750,
    "experience": 80,
    "home_strength": 1.05,
    "is_placeholder": false,
    "confidence_penalty": 0.0
  },
  {
    "team_code": "KOR",
    "team_name": "South Korea",
    "group": "GROUP_E",
    "overall": 1750,
    "attack": 1780,
    "defense": 1700,
    "experience": 78,
    "home_strength": 1.05,
    "is_placeholder": false,
    "confidence_penalty": 0.0
  },
  {
    "team_code": "AUS",
    "team_name": "Australia",
    "group": "GROUP_E",
    "overall": 1700,
    "attack": 1720,
    "defense": 1680,
    "experience": 75,
    "home_strength": 1.05,
    "is_placeholder": false,
    "confidence_penalty": 0.0
  },
  {
    "team_code": "IRN",
    "team_name": "Iran",
    "group": "GROUP_E",
    "overall": 1680,
    "attack": 1650,
    "defense": 1720,
    "experience": 76,
    "home_strength": 1.1,
    "is_placeholder": false,
    "confidence_penalty": 0.0
  },
  {
    "team_code": "SEN",
    "team_name": "Senegal",
    "group": "GROUP_F",
    "overall": 1800,
    "attack": 1850,
    "defense": 1750,
    "experience": 72,
    "home_strength": 1.05,
    "is_placeholder": false,
    "confidence_penalty": 0.0
  },
  {
    "team_code": "MAR",
    "team_name": "Morocco",
    "group": "GROUP_F",
    "overall": 1850,
    "attack": 1820,
    "defense": 1880,
    "experience": 74,
    "home_strength": 1.1,
    "is_placeholder": false,
    "confidence_penalty": 0.0
  },
  {
    "team_code": "EGY",
    "team_name": "Egypt",
    "group": "GROUP_F",
    "overall": 1700,
    "attack": 1750,
    "defense": 1680,
    "experience": 70,
    "home_strength": 1.1,
    "is_placeholder": false,
    "confidence_penalty": 0.0
  },
  {
    "team_code": "NGA",
    "team_name": "Nigeria",
    "group": "GROUP_F",
    "overall": 1720,
    "attack": 1780,
    "defense": 1650,
    "experience": 72,
    "home_strength": 1.05,
    "is_placeholder": false,
    "confidence_penalty": 0.0
  },
  {
    "team_code": "DEN",
    "team_name": "Denmark",
    "group": "GROUP_G",
    "overall": 1880,
    "attack": 1850,
    "defense": 1900,
    "experience": 80,
    "home_strength": 1.05,
    "is_placeholder": false,
    "confidence_penalty": 0.0
  },
  {
    "team_code": "SUI",
    "team_name": "Switzerland",
    "group": "GROUP_G",
    "overall": 1850,
    "attack": 1820,
    "defense": 1880,
    "experience": 80,
    "home_strength": 1.05,
    "is_placeholder": false,
    "confidence_penalty": 0.0
  },
  {
    "team_code": "AUT",
    "team_name": "Austria",
    "group": "GROUP_G",
    "overall": 1800,
    "attack": 1820,
    "defense": 1780,
    "experience": 74,
    "home_strength": 1.08,
    "is_placeholder": false,
    "confidence_penalty": 0.0
  },
  {
    "team_code": "CHI",
    "team_name": "Chile",
    "group": "GROUP_H",
    "overall": 1780,
    "attack": 1800,
    "defense": 1750,
    "experience": 78,
    "home_strength": 1.15,
    "is_placeholder": false,
    "confidence_penalty": 0.0
  },
  {
    "team_code": "ECU",
    "team_name": "Ecuador",
    "group": "GROUP_H",
    "overall": 1720,
    "attack": 1700,
    "defense": 1680,
    "experience": 68,
    "home_strength": 1.2,
    "is_placeholder": false,
    "confidence_penalty": 0.0
  },
  {
    "team_code": "PER",
    "team_name": "Peru",
    "group": "GROUP_H",
    "overall": 1700,
    "attack": 1680,
    "defense": 1720,
    "experience": 70,
    "home_strength": 1.15,
    "is_placeholder": false,
    "confidence_penalty": 0.0
  },
  {
    "team_code": "PAR",
    "team_name": "Paraguay",
    "group": "GROUP_H",
    "overall": 1680,
    "attack": 1650,
    "defense": 1720,
    "experience": 70,
    "home_strength": 1.1,
    "is_placeholder": false,
    "confidence_penalty": 0.0
  },
  {
    "team_code": "SWE",
    "team_name": "Sweden",
    "group": "GROUP_I",
    "overall": 1820,
    "attack": 1850,
    "defense": 1800,
    "experience": 78,
    "home_strength": 1.05,
    "is_placeholder": false,
    "confidence_penalty": 0.0
  },
  {
    "team_code": "NOR",
    "team_name": "Norway",
    "group": "GROUP_I",
    "overall": 1850,
    "attack": 1900,
    "defense": 1780,
    "experience": 65,
    "home_strength": 1.05,
    "is_placeholder": false,
    "confidence_penalty": 0.0
  },
  {
    "team_code": "POL",
    "team_name": "Poland",
    "group": "GROUP_I",
    "overall": 1780,
    "attack": 1820,
    "defense": 1750,
    "experience": 78,
    "home_strength": 1.05,
    "is_placeholder": false,
    "confidence_penalty": 0.0
  },
  {
    "team_code": "CZE",
    "team_name": "Czech Republic",
    "group": "GROUP_I",
    "overall": 1750,
    "attack": 1720,
    "defense": 1780,
    "experience": 76,
    "home_strength": 1.05,
    "is_placeholder": false,
    "confidence_penalty": 0.0
  },
  {
    "team_code": "SRB",
    "team_name": "Serbia",
    "group": "GROUP_J",
    "overall": 1800,
    "attack": 1850,
    "defense": 1750,
    "experience": 76,
    "home_strength": 1.08,
    "is_placeholder": false,
    "confidence_penalty": 0.0
  },
  {
    "team_code": "TUR",
    "team_name": "Turkey",
    "group": "GROUP_J",
    "overall": 1780,
    "attack": 1800,
    "defense": 1720,
    "experience": 74,
    "home_strength": 1.1,
    "is_placeholder": false,
    "confidence_penalty": 0.0
  },
  {
    "team_code": "UKR",
    "team_name": "Ukraine",
    "group": "GROUP_J",
    "overall": 1750,
    "attack": 1720,
    "defense": 1780,
    "experience": 72,
    "home_strength": 1.05,
    "is_placeholder": false,
    "confidence_penalty": 0.0
  },
  {
    "team_code": "ROU",
    "team_name": "Romania",
    "group": "GROUP_J",
    "overall": 1700,
    "attack": 1680,
    "defense": 1720,
    "experience": 68,
    "home_strength": 1.05,
    "is_placeholder": false,
    "confidence_penalty": 0.0
  },
  {
    "team_code": "KSA",
    "team_name": "Saudi Arabia",